root@lamp-s-1vcpu-1gb-tor1-01:~# tcpdump -n -i eth0
tcpdump: verbose output suppressed, use -v or -vv for full protocol decode
listening on eth0, link-type EN10MB (Ethernet), capture size 262144 bytes
10:41:38.786547 IP 165.227.45.151.22 > 174.91.38.241.63354: Flags [P.], seq 2190603837:2190604025, ack 2960520694, win 319, length 188
10:41:38.786678 IP 165.227.45.151.22 > 174.91.38.241.63354: Flags [P.], seq 188:360, ack 1, win 319, length 172
10:41:38.786718 IP 165.227.45.151.22 > 174.91.38.241.63354: Flags [P.], seq 360:396, ack 1, win 319, length 36
10:41:38.786767 IP 165.227.45.151.22 > 174.91.38.241.63354: Flags [P.], seq 396:544, ack 1, win 319, length 148
10:41:38.786800 IP 165.227.45.151.22 > 174.91.38.241.63354: Flags [P.], seq 544:580, ack 1, win 319, length 36
10:41:38.786845 IP 165.227.45.151.22 > 174.91.38.241.63354: Flags [P.], seq 580:728, ack 1, win 319, length 148
10:41:38.787281 IP 165.227.45.151.22 > 174.91.38.241.63354: Flags [P.], seq 728:764, ack 1, win 319, length 36
10:41:38.787344 IP 165.227.45.151.22 > 174.91.38.241.63354: Flags [P.], seq 764:912, ack 1, win 319, length 148
10:41:38.787436 IP 165.227.45.151.22 > 174.91.38.241.63354: Flags [P.], seq 912:948, ack 1, win 319, length 36
10:41:38.787484 IP 165.227.45.151.22 > 174.91.38.241.63354: Flags [P.], seq 948:1096, ack 1, win 319, length 148
10:41:38.796987 IP 174.91.38.241.63354 > 165.227.45.151.22: Flags [.], ack 396, win 8287, length 0
10:41:38.797036 IP 165.227.45.151.22 > 174.91.38.241.63354: Flags [P.], seq 1096:2052, ack 1, win 319, length 956
10:41:38.797058 IP 174.91.38.241.63354 > 165.227.45.151.22: Flags [.], ack 544, win 8286, length 0
10:41:38.797203 IP 165.227.45.151.22 > 174.91.38.241.63354: Flags [P.], seq 2052:2184, ack 1, win 319, length 132
10:41:38.797275 IP 165.227.45.151.22 > 174.91.38.241.63354: Flags [P.], seq 2184:2220, ack 1, win 319, length 36
10:41:38.797365 IP 165.227.45.151.22 > 174.91.38.241.63354: Flags [P.], seq 2220:2368, ack 1, win 319, length 148
10:41:38.797405 IP 165.227.45.151.22 > 174.91.38.241.63354: Flags [P.], seq 2368:2404, ack 1, win 319, length 36
10:41:38.797452 IP 165.227.45.151.22 > 174.91.38.241.63354: Flags [P.], seq 2404:2536, ack 1, win 319, length 132
10:41:38.797487 IP 165.227.45.151.22 > 174.91.38.241.63354: Flags [P.], seq 2536:2572, ack 1, win 319, length 36
10:41:38.797531 IP 165.227.45.151.22 > 174.91.38.241.63354: Flags [P.], seq 2572:2720, ack 1, win 319, length 148
10:41:38.799479 IP 174.91.38.241.63354 > 165.227.45.151.22: Flags [.], ack 1096, win 8290, length 0
10:41:38.799504 IP 165.227.45.151.22 > 174.91.38.241.63354: Flags [P.], seq 2720:3860, ack 1, win 319, length 1140
10:41:38.799602 IP 165.227.45.151.22 > 174.91.38.241.63354: Flags [P.], seq 3860:4000, ack 1, win 319, length 140
10:41:38.799645 IP 165.227.45.151.22 > 174.91.38.241.63354: Flags [P.], seq 4000:4036, ack 1, win 319, length 36
10:41:38.799700 IP 165.227.45.151.22 > 174.91.38.241.63354: Flags [P.], seq 4036:4184, ack 1, win 319, length 148
10:41:38.799734 IP 165.227.45.151.22 > 174.91.38.241.63354: Flags [P.], seq 4184:4220, ack 1, win 319, length 36
10:41:38.799743 IP 174.91.38.241.63354 > 165.227.45.151.22: Flags [.], ack 728, win 8292, length 0
10:41:38.799794 IP 165.227.45.151.22 > 174.91.38.241.63354: Flags [P.], seq 4220:4368, ack 1, win 319, length 148
10:41:38.799830 IP 165.227.45.151.22 > 174.91.38.241.63354: Flags [P.], seq 4368:4404, ack 1, win 319, length 36
10:41:38.799875 IP 165.227.45.151.22 > 174.91.38.241.63354: Flags [P.], seq 4404:4552, ack 1, win 319, length 148
10:41:38.799953 IP 165.227.45.151.22 > 174.91.38.241.63354: Flags [P.], seq 4588:4736, ack 1, win 319, length 148
10:41:38.800046 IP 165.227.45.151.22 > 174.91.38.241.63354: Flags [P.], seq 4772:4920, ack 1, win 319, length 148
10:41:38.810278 IP 174.91.38.241.63354 > 165.227.45.151.22: Flags [.], ack 2720, win 8290, length 0
10:41:38.810320 IP 165.227.45.151.22 > 174.91.38.241.63354: Flags [P.], seq 4920:6044, ack 1, win 319, length 1124
10:41:38.810476 IP 174.91.38.241.63354 > 165.227.45.151.22: Flags [.], ack 2368, win 8292, length 0
10:41:38.810484 IP 174.91.38.241.63354 > 165.227.45.151.22: Flags [.], ack 4036, win 8292, length 0
10:41:38.810501 IP 165.227.45.151.22 > 174.91.38.241.63354: Flags [P.], seq 6044:6184, ack 1, win 319, length 140
10:41:38.810561 IP 165.227.45.151.22 > 174.91.38.241.63354: Flags [P.], seq 6184:6220, ack 1, win 319, length 36
10:41:38.810644 IP 165.227.45.151.22 > 174.91.38.241.63354: Flags [P.], seq 6220:6368, ack 1, win 319, length 148
10:41:38.810699 IP 165.227.45.151.22 > 174.91.38.241.63354: Flags [P.], seq 6368:6404, ack 1, win 319, length 36
10:41:38.810754 IP 165.227.45.151.22 > 174.91.38.241.63354: Flags [P.], seq 6404:6544, ack 1, win 319, length 140
10:41:38.810868 IP 165.227.45.151.22 > 174.91.38.241.63354: Flags [P.], seq 6580:6720, ack 1, win 319, length 140
10:41:38.810977 IP 165.227.45.151.22 > 174.91.38.241.63354: Flags [P.], seq 6756:6904, ack 1, win 319, length 148
10:41:38.811065 IP 165.227.45.151.22 > 174.91.38.241.63354: Flags [P.], seq 6940:7088, ack 1, win 319, length 148
10:41:38.811207 IP 165.227.45.151.22 > 174.91.38.241.63354: Flags [P.], seq 7124:7272, ack 1, win 319, length 148
10:41:38.811334 IP 165.227.45.151.22 > 174.91.38.241.63354: Flags [P.], seq 7308:7456, ack 1, win 319, length 148
10:41:38.811477 IP 165.227.45.151.22 > 174.91.38.241.63354: Flags [P.], seq 7492:7640, ack 1, win 319, length 148
10:41:38.811557 IP 165.227.45.151.22 > 174.91.38.241.63354: Flags [P.], seq 7676:7824, ack 1, win 319, length 148
10:41:38.811635 IP 165.227.45.151.22 > 174.91.38.241.63354: Flags [P.], seq 7860:8008, ack 1, win 319, length 148
10:41:38.811688 IP 174.91.38.241.63354 > 165.227.45.151.22: Flags [.], ack 4920, win 8288, length 0
10:41:38.811823 IP 165.227.45.151.22 > 174.91.38.241.63354: Flags [P.], seq 8228:8376, ack 1, win 319, length 148
10:41:38.811899 IP 165.227.45.151.22 > 174.91.38.241.63354: Flags [P.], seq 8412:8560, ack 1, win 319, length 148
10:41:38.812004 IP 165.227.45.151.22 > 174.91.38.241.63354: Flags [P.], seq 8596:8744, ack 1, win 319, length 148
10:41:38.812083 IP 165.227.45.151.22 > 174.91.38.241.63354: Flags [P.], seq 8780:8928, ack 1, win 319, length 148
10:41:38.812202 IP 165.227.45.151.22 > 174.91.38.241.63354: Flags [P.], seq 8964:9112, ack 1, win 319, length 148
10:41:38.812284 IP 165.227.45.151.22 > 174.91.38.241.63354: Flags [P.], seq 9148:9288, ack 1, win 319, length 140
10:41:38.812362 IP 165.227.45.151.22 > 174.91.38.241.63354: Flags [P.], seq 9324:9472, ack 1, win 319, length 148
10:41:38.814503 IP 165.227.45.151.25 > 167.139.12.82.11084: Flags [S.], seq 2485587621, ack 2951702068, win 29200, options [mss 1460], length 0
10:41:38.822029 IP 174.91.38.241.63354 > 165.227.45.151.22: Flags [.], ack 6544, win 8290, length 0
10:41:38.822080 IP 165.227.45.151.22 > 174.91.38.241.63354: Flags [P.], seq 9508:10828, ack 1, win 319, length 1320
10:41:38.822104 IP 174.91.38.241.63354 > 165.227.45.151.22: Flags [.], ack 6184, win 8292, length 0
10:41:38.822109 IP 174.91.38.241.63354 > 165.227.45.151.22: Flags [.], ack 6756, win 8290, length 0
10:41:38.822276 IP 165.227.45.151.22 > 174.91.38.241.63354: Flags [P.], seq 10828:10968, ack 1, win 319, length 140
10:41:38.822340 IP 165.227.45.151.22 > 174.91.38.241.63354: Flags [P.], seq 10968:11004, ack 1, win 319, length 36
10:41:38.822402 IP 165.227.45.151.22 > 174.91.38.241.63354: Flags [P.], seq 11004:11160, ack 1, win 319, length 156
10:41:38.822457 IP 165.227.45.151.22 > 174.91.38.241.63354: Flags [P.], seq 11160:11196, ack 1, win 319, length 36
10:41:38.822546 IP 165.227.45.151.22 > 174.91.38.241.63354: Flags [P.], seq 11196:11336, ack 1, win 319, length 140
10:41:38.822656 IP 165.227.45.151.22 > 174.91.38.241.63354: Flags [P.], seq 11372:11512, ack 1, win 319, length 140
10:41:38.822774 IP 165.227.45.151.22 > 174.91.38.241.63354: Flags [P.], seq 11548:11704, ack 1, win 319, length 156
10:41:38.822877 IP 165.227.45.151.22 > 174.91.38.241.63354: Flags [P.], seq 11740:11888, ack 1, win 319, length 148
10:41:38.824219 IP 174.91.38.241.63354 > 165.227.45.151.22: Flags [.], ack 8192, win 8292, length 0
10:41:38.824248 IP 165.227.45.151.22 > 174.91.38.241.63354: Flags [P.], seq 11888:13068, ack 1, win 319, length 1180
10:41:38.824332 IP 165.227.45.151.22 > 174.91.38.241.63354: Flags [P.], seq 13068:13208, ack 1, win 319, length 140
10:41:38.824386 IP 165.227.45.151.22 > 174.91.38.241.63354: Flags [P.], seq 13208:13244, ack 1, win 319, length 36
10:41:38.824448 IP 165.227.45.151.22 > 174.91.38.241.63354: Flags [P.], seq 13244:13400, ack 1, win 319, length 156
10:41:38.824496 IP 174.91.38.241.63354 > 165.227.45.151.22: Flags [.], ack 9508, win 8287, length 0
10:41:38.824538 IP 165.227.45.151.22 > 174.91.38.241.63354: Flags [P.], seq 13400:13436, ack 1, win 319, length 36
10:41:38.824612 IP 165.227.45.151.22 > 174.91.38.241.63354: Flags [P.], seq 13436:13592, ack 1, win 319, length 156
10:41:38.824689 IP 165.227.45.151.22 > 174.91.38.241.63354: Flags [P.], seq 13592:13748, ack 1, win 319, length 156
10:41:38.824793 IP 165.227.45.151.22 > 174.91.38.241.63354: Flags [P.], seq 13748:14120, ack 1, win 319, length 372
10:41:38.824905 IP 165.227.45.151.22 > 174.91.38.241.63354: Flags [P.], seq 14120:14508, ack 1, win 319, length 388
10:41:38.824980 IP 165.227.45.151.22 > 174.91.38.241.63354: Flags [P.], seq 14508:14664, ack 1, win 319, length 156
10:41:38.825059 IP 165.227.45.151.22 > 174.91.38.241.63354: Flags [P.], seq 14664:14820, ack 1, win 319, length 156
10:41:38.825127 IP 165.227.45.151.22 > 174.91.38.241.63354: Flags [P.], seq 14820:14976, ack 1, win 319, length 156
10:41:38.825199 IP 165.227.45.151.22 > 174.91.38.241.63354: Flags [P.], seq 14976:15132, ack 1, win 319, length 156
10:41:38.825278 IP 165.227.45.151.22 > 174.91.38.241.63354: Flags [P.], seq 15132:15288, ack 1, win 319, length 156
10:41:38.825383 IP 165.227.45.151.22 > 174.91.38.241.63354: Flags [P.], seq 15288:15444, ack 1, win 319, length 156
10:41:38.825469 IP 165.227.45.151.22 > 174.91.38.241.63354: Flags [P.], seq 15444:15600, ack 1, win 319, length 156
10:41:38.825551 IP 165.227.45.151.22 > 174.91.38.241.63354: Flags [P.], seq 15600:15756, ack 1, win 319, length 156
10:41:38.825632 IP 165.227.45.151.22 > 174.91.38.241.63354: Flags [P.], seq 15756:15912, ack 1, win 319, length 156
10:41:38.825695 IP 165.227.45.151.22 > 174.91.38.241.63354: Flags [P.], seq 15912:16068, ack 1, win 319, length 156
10:41:38.825748 IP 165.227.45.151.22 > 174.91.38.241.63354: Flags [P.], seq 16068:16224, ack 1, win 319, length 156
10:41:38.825800 IP 165.227.45.151.22 > 174.91.38.241.63354: Flags [P.], seq 16224:16380, ack 1, win 319, length 156
10:41:38.825850 IP 165.227.45.151.22 > 174.91.38.241.63354: Flags [P.], seq 16380:16536, ack 1, win 319, length 156
10:41:38.825899 IP 165.227.45.151.22 > 174.91.38.241.63354: Flags [P.], seq 16536:16692, ack 1, win 319, length 156
10:41:38.825949 IP 165.227.45.151.22 > 174.91.38.241.63354: Flags [P.], seq 16692:16848, ack 1, win 319, length 156
10:41:38.825999 IP 165.227.45.151.22 > 174.91.38.241.63354: Flags [P.], seq 16848:17004, ack 1, win 319, length 156
10:41:38.826038 IP 165.227.45.151.22 > 174.91.38.241.63354: Flags [P.], seq 17004:17160, ack 1, win 319, length 156
10:41:38.826089 IP 165.227.45.151.22 > 174.91.38.241.63354: Flags [P.], seq 17160:17316, ack 1, win 319, length 156
10:41:38.826139 IP 165.227.45.151.22 > 174.91.38.241.63354: Flags [P.], seq 17316:17472, ack 1, win 319, length 156
10:41:38.826189 IP 165.227.45.151.22 > 174.91.38.241.63354: Flags [P.], seq 17472:17628, ack 1, win 319, length 156
10:41:38.826241 IP 165.227.45.151.22 > 174.91.38.241.63354: Flags [P.], seq 17628:17784, ack 1, win 319, length 156
10:41:38.826293 IP 165.227.45.151.22 > 174.91.38.241.63354: Flags [P.], seq 17784:17940, ack 1, win 319, length 156
10:41:38.826343 IP 165.227.45.151.22 > 174.91.38.241.63354: Flags [P.], seq 17940:18096, ack 1, win 319, length 156
10:41:38.826394 IP 165.227.45.151.22 > 174.91.38.241.63354: Flags [P.], seq 18096:18252, ack 1, win 319, length 156
10:41:38.826457 IP 165.227.45.151.22 > 174.91.38.241.63354: Flags [P.], seq 18252:18408, ack 1, win 319, length 156
10:41:38.826546 IP 165.227.45.151.22 > 174.91.38.241.63354: Flags [P.], seq 18408:18564, ack 1, win 319, length 156
10:41:38.832231 IP 174.91.38.241.63354 > 165.227.45.151.22: Flags [.], ack 10828, win 8292, length 0
10:41:38.832255 IP 165.227.45.151.22 > 174.91.38.241.63354: Flags [P.], seq 18564:18720, ack 1, win 319, length 156
10:41:38.835215 IP 174.91.38.241.63354 > 165.227.45.151.22: Flags [.], ack 11004, win 8291, length 0
10:41:38.835241 IP 165.227.45.151.22 > 174.91.38.241.63354: Flags [P.], seq 18720:18980, ack 1, win 319, length 260
10:41:38.835330 IP 165.227.45.151.22 > 174.91.38.241.63354: Flags [P.], seq 18980:19240, ack 1, win 319, length 260
10:41:38.836199 IP 174.91.38.241.63354 > 165.227.45.151.22: Flags [.], ack 11548, win 8289, length 0
10:41:38.836218 IP 165.227.45.151.22 > 174.91.38.241.63354: Flags [P.], seq 19240:19396, ack 1, win 319, length 156
10:41:38.836304 IP 165.227.45.151.22 > 174.91.38.241.63354: Flags [P.], seq 19396:19656, ack 1, win 319, length 260
10:41:38.836364 IP 165.227.45.151.22 > 174.91.38.241.63354: Flags [P.], seq 19656:19812, ack 1, win 319, length 156
10:41:38.836416 IP 165.227.45.151.22 > 174.91.38.241.63354: Flags [P.], seq 19812:19968, ack 1, win 319, length 156
10:41:38.836469 IP 165.227.45.151.22 > 174.91.38.241.63354: Flags [P.], seq 19968:20124, ack 1, win 319, length 156
10:41:38.836520 IP 165.227.45.151.22 > 174.91.38.241.63354: Flags [P.], seq 20124:20280, ack 1, win 319, length 156
10:41:38.836966 IP 174.91.38.241.63354 > 165.227.45.151.22: Flags [.], ack 11888, win 8288, length 0
10:41:38.836992 IP 165.227.45.151.22 > 174.91.38.241.63354: Flags [P.], seq 20280:20436, ack 1, win 319, length 156
10:41:38.837127 IP 165.227.45.151.22 > 174.91.38.241.63354: Flags [P.], seq 20436:20696, ack 1, win 319, length 260
10:41:38.837197 IP 165.227.45.151.22 > 174.91.38.241.63354: Flags [P.], seq 20696:20852, ack 1, win 319, length 156
10:41:38.837211 IP 174.91.38.241.63354 > 165.227.45.151.22: Flags [.], ack 13068, win 8292, length 0
10:41:38.837216 IP 174.91.38.241.63354 > 165.227.45.151.22: Flags [.], ack 14508, win 8286, length 0
10:41:38.837218 IP 174.91.38.241.63354 > 165.227.45.151.22: Flags [.], ack 13592, win 8290, length 0
10:41:38.837334 IP 165.227.45.151.22 > 174.91.38.241.63354: Flags [P.], seq 20852:21312, ack 1, win 319, length 460
10:41:38.837394 IP 165.227.45.151.22 > 174.91.38.241.63354: Flags [P.], seq 21312:21468, ack 1, win 319, length 156
10:41:38.837448 IP 165.227.45.151.22 > 174.91.38.241.63354: Flags [P.], seq 21468:21624, ack 1, win 319, length 156
10:41:38.837505 IP 165.227.45.151.22 > 174.91.38.241.63354: Flags [P.], seq 21624:21780, ack 1, win 319, length 156
10:41:38.837558 IP 165.227.45.151.22 > 174.91.38.241.63354: Flags [P.], seq 21780:21936, ack 1, win 319, length 156
10:41:38.837608 IP 165.227.45.151.22 > 174.91.38.241.63354: Flags [P.], seq 21936:22092, ack 1, win 319, length 156
10:41:38.837666 IP 165.227.45.151.22 > 174.91.38.241.63354: Flags [P.], seq 22092:22248, ack 1, win 319, length 156
10:41:38.837727 IP 165.227.45.151.22 > 174.91.38.241.63354: Flags [P.], seq 22248:22404, ack 1, win 319, length 156
10:41:38.837778 IP 165.227.45.151.22 > 174.91.38.241.63354: Flags [P.], seq 22404:22560, ack 1, win 319, length 156
10:41:38.837827 IP 165.227.45.151.22 > 174.91.38.241.63354: Flags [P.], seq 22560:22716, ack 1, win 319, length 156
10:41:38.840710 IP 174.91.38.241.63354 > 165.227.45.151.22: Flags [.], ack 18564, win 8292, length 0
10:41:38.840740 IP 165.227.45.151.22 > 174.91.38.241.63354: Flags [P.], seq 22716:22872, ack 1, win 319, length 156
10:41:38.840835 IP 165.227.45.151.22 > 174.91.38.241.63354: Flags [P.], seq 22872:23132, ack 1, win 319, length 260
10:41:38.840915 IP 165.227.45.151.22 > 174.91.38.241.63354: Flags [P.], seq 23132:23288, ack 1, win 319, length 156
10:41:38.840939 IP 174.91.38.241.63354 > 165.227.45.151.22: Flags [.], ack 16848, win 8292, length 0
10:41:38.841081 IP 165.227.45.151.22 > 174.91.38.241.63354: Flags [P.], seq 23288:23548, ack 1, win 319, length 260
10:41:38.841144 IP 165.227.45.151.22 > 174.91.38.241.63354: Flags [P.], seq 23548:23704, ack 1, win 319, length 156
10:41:38.841194 IP 165.227.45.151.22 > 174.91.38.241.63354: Flags [P.], seq 23704:23860, ack 1, win 319, length 156
10:41:38.841242 IP 165.227.45.151.22 > 174.91.38.241.63354: Flags [P.], seq 23860:24016, ack 1, win 319, length 156
10:41:38.841304 IP 165.227.45.151.22 > 174.91.38.241.63354: Flags [P.], seq 24016:24172, ack 1, win 319, length 156
10:41:38.841362 IP 165.227.45.151.22 > 174.91.38.241.63354: Flags [P.], seq 24172:24328, ack 1, win 319, length 156
10:41:38.841444 IP 165.227.45.151.22 > 174.91.38.241.63354: Flags [P.], seq 24328:24484, ack 1, win 319, length 156
10:41:38.841498 IP 165.227.45.151.22 > 174.91.38.241.63354: Flags [P.], seq 24484:24640, ack 1, win 319, length 156
10:41:38.841548 IP 165.227.45.151.22 > 174.91.38.241.63354: Flags [P.], seq 24640:24796, ack 1, win 319, length 156
10:41:38.841595 IP 165.227.45.151.22 > 174.91.38.241.63354: Flags [P.], seq 24796:24952, ack 1, win 319, length 156
10:41:38.841643 IP 165.227.45.151.22 > 174.91.38.241.63354: Flags [P.], seq 24952:25108, ack 1, win 319, length 156
10:41:38.841690 IP 165.227.45.151.22 > 174.91.38.241.63354: Flags [P.], seq 25108:25264, ack 1, win 319, length 156
10:41:38.841737 IP 165.227.45.151.22 > 174.91.38.241.63354: Flags [P.], seq 25264:25420, ack 1, win 319, length 156
10:41:38.841804 IP 165.227.45.151.22 > 174.91.38.241.63354: Flags [P.], seq 25420:25576, ack 1, win 319, length 156
10:41:38.841893 IP 165.227.45.151.22 > 174.91.38.241.63354: Flags [P.], seq 25576:25732, ack 1, win 319, length 156
10:41:38.841958 IP 165.227.45.151.22 > 174.91.38.241.63354: Flags [P.], seq 25732:25888, ack 1, win 319, length 156
10:41:38.842033 IP 165.227.45.151.22 > 174.91.38.241.63354: Flags [P.], seq 25888:26044, ack 1, win 319, length 156
10:41:38.842090 IP 165.227.45.151.22 > 174.91.38.241.63354: Flags [P.], seq 26044:26200, ack 1, win 319, length 156
10:41:38.842142 IP 165.227.45.151.22 > 174.91.38.241.63354: Flags [P.], seq 26200:26356, ack 1, win 319, length 156
10:41:38.842192 IP 165.227.45.151.22 > 174.91.38.241.63354: Flags [P.], seq 26356:26512, ack 1, win 319, length 156
10:41:38.842244 IP 165.227.45.151.22 > 174.91.38.241.63354: Flags [P.], seq 26512:26668, ack 1, win 319, length 156
10:41:38.842294 IP 165.227.45.151.22 > 174.91.38.241.63354: Flags [P.], seq 26668:26824, ack 1, win 319, length 156
10:41:38.842345 IP 165.227.45.151.22 > 174.91.38.241.63354: Flags [P.], seq 26824:26980, ack 1, win 319, length 156
10:41:38.842394 IP 165.227.45.151.22 > 174.91.38.241.63354: Flags [P.], seq 26980:27136, ack 1, win 319, length 156
10:41:38.846753 IP 174.91.38.241.63354 > 165.227.45.151.22: Flags [.], ack 19812, win 8287, length 0
10:41:38.846777 IP 165.227.45.151.22 > 174.91.38.241.63354: Flags [P.], seq 27136:27292, ack 1, win 319, length 156
10:41:38.846880 IP 165.227.45.151.22 > 174.91.38.241.63354: Flags [P.], seq 27292:27552, ack 1, win 319, length 260
10:41:38.846938 IP 165.227.45.151.22 > 174.91.38.241.63354: Flags [P.], seq 27552:27708, ack 1, win 319, length 156
10:41:38.846965 IP 174.91.38.241.63354 > 165.227.45.151.22: Flags [.], ack 19396, win 8289, length 0
10:41:38.846971 IP 174.91.38.241.63354 > 165.227.45.151.22: Flags [.], ack 19240, win 8289, length 0
10:41:38.847077 IP 165.227.45.151.22 > 174.91.38.241.63354: Flags [P.], seq 27708:28064, ack 1, win 319, length 356
10:41:38.847133 IP 165.227.45.151.22 > 174.91.38.241.63354: Flags [P.], seq 28064:28220, ack 1, win 319, length 156
10:41:38.847194 IP 165.227.45.151.22 > 174.91.38.241.63354: Flags [P.], seq 28220:28376, ack 1, win 319, length 156
10:41:38.847719 IP 174.91.38.241.63354 > 165.227.45.151.22: Flags [.], ack 22560, win 8292, length 0
10:41:38.847746 IP 165.227.45.151.22 > 174.91.38.241.63354: Flags [P.], seq 28376:28532, ack 1, win 319, length 156
10:41:38.847764 IP 174.91.38.241.63354 > 165.227.45.151.22: Flags [.], ack 20852, win 8290, length 0
10:41:38.847851 IP 165.227.45.151.22 > 174.91.38.241.63354: Flags [P.], seq 28532:28888, ack 1, win 319, length 356
10:41:38.847906 IP 165.227.45.151.22 > 174.91.38.241.63354: Flags [P.], seq 28888:29044, ack 1, win 319, length 156
10:41:38.847939 IP 174.91.38.241.63354 > 165.227.45.151.22: Flags [.], ack 20280, win 8292, length 0
10:41:38.847989 IP 165.227.45.151.22 > 174.91.38.241.63354: Flags [P.], seq 29044:29304, ack 1, win 319, length 260
10:41:38.848046 IP 165.227.45.151.22 > 174.91.38.241.63354: Flags [P.], seq 29304:29460, ack 1, win 319, length 156
10:41:38.848097 IP 165.227.45.151.22 > 174.91.38.241.63354: Flags [P.], seq 29460:29616, ack 1, win 319, length 156
10:41:38.848144 IP 165.227.45.151.22 > 174.91.38.241.63354: Flags [P.], seq 29616:29772, ack 1, win 319, length 156
10:41:38.848193 IP 165.227.45.151.22 > 174.91.38.241.63354: Flags [P.], seq 29772:29928, ack 1, win 319, length 156
10:41:38.848240 IP 165.227.45.151.22 > 174.91.38.241.63354: Flags [P.], seq 29928:30084, ack 1, win 319, length 156
10:41:38.848288 IP 165.227.45.151.22 > 174.91.38.241.63354: Flags [P.], seq 30084:30240, ack 1, win 319, length 156
10:41:38.848335 IP 165.227.45.151.22 > 174.91.38.241.63354: Flags [P.], seq 30240:30396, ack 1, win 319, length 156
10:41:38.848384 IP 165.227.45.151.22 > 174.91.38.241.63354: Flags [P.], seq 30396:30552, ack 1, win 319, length 156
10:41:38.848422 IP 165.227.45.151.22 > 174.91.38.241.63354: Flags [P.], seq 30552:30708, ack 1, win 319, length 156
10:41:38.848447 IP 174.91.38.241.63354 > 165.227.45.151.22: Flags [.], ack 22716, win 8291, length 0
10:41:38.848496 IP 165.227.45.151.22 > 174.91.38.241.63354: Flags [P.], seq 30708:30968, ack 1, win 319, length 260
10:41:38.848549 IP 165.227.45.151.22 > 174.91.38.241.63354: Flags [P.], seq 30968:31124, ack 1, win 319, length 156
10:41:38.848596 IP 165.227.45.151.22 > 174.91.38.241.63354: Flags [P.], seq 31124:31280, ack 1, win 319, length 156
10:41:38.852460 IP 174.91.38.241.63354 > 165.227.45.151.22: Flags [.], ack 24640, win 8289, length 0
10:41:38.852482 IP 165.227.45.151.22 > 174.91.38.241.63354: Flags [P.], seq 31280:31436, ack 1, win 319, length 156
10:41:38.852495 IP 174.91.38.241.63354 > 165.227.45.151.22: Flags [.], ack 24328, win 8291, length 0
10:41:38.852590 IP 165.227.45.151.22 > 174.91.38.241.63354: Flags [P.], seq 31436:31792, ack 1, win 319, length 356
10:41:38.852644 IP 165.227.45.151.22 > 174.91.38.241.63354: Flags [P.], seq 31792:31948, ack 1, win 319, length 156
10:41:38.852698 IP 174.91.38.241.63354 > 165.227.45.151.22: Flags [.], ack 24016, win 8292, length 0
10:41:38.852704 IP 174.91.38.241.63354 > 165.227.45.151.22: Flags [.], ack 23704, win 8287, length 0
10:41:38.852758 IP 165.227.45.151.22 > 174.91.38.241.63354: Flags [P.], seq 31948:32104, ack 1, win 319, length 156
10:41:38.852817 IP 165.227.45.151.22 > 174.91.38.241.63354: Flags [P.], seq 32104:32460, ack 1, win 319, length 356
10:41:38.852867 IP 165.227.45.151.22 > 174.91.38.241.63354: Flags [P.], seq 32460:32616, ack 1, win 319, length 156
10:41:38.852916 IP 165.227.45.151.22 > 174.91.38.241.63354: Flags [P.], seq 32616:32772, ack 1, win 319, length 156
10:41:38.852942 IP 174.91.38.241.63354 > 165.227.45.151.22: Flags [.], ack 25108, win 8288, length 0
10:41:38.853008 IP 165.227.45.151.22 > 174.91.38.241.63354: Flags [P.], seq 32772:33032, ack 1, win 319, length 260
10:41:38.853084 IP 165.227.45.151.22 > 174.91.38.241.63354: Flags [P.], seq 33032:33188, ack 1, win 319, length 156
10:41:38.853175 IP 165.227.45.151.22 > 174.91.38.241.63354: Flags [P.], seq 33188:33344, ack 1, win 319, length 156
10:41:38.853242 IP 165.227.45.151.22 > 174.91.38.241.63354: Flags [P.], seq 33344:33500, ack 1, win 319, length 156
10:41:38.853308 IP 165.227.45.151.22 > 174.91.38.241.63354: Flags [P.], seq 33500:33656, ack 1, win 319, length 156
10:41:38.853362 IP 165.227.45.151.22 > 174.91.38.241.63354: Flags [P.], seq 33656:33812, ack 1, win 319, length 156
10:41:38.853412 IP 165.227.45.151.22 > 174.91.38.241.63354: Flags [P.], seq 33812:33968, ack 1, win 319, length 156
10:41:38.853954 IP 174.91.38.241.63354 > 165.227.45.151.22: Flags [.], ack 26200, win 8292, length 0
10:41:38.853976 IP 165.227.45.151.22 > 174.91.38.241.63354: Flags [P.], seq 33968:34124, ack 1, win 319, length 156
10:41:38.854075 IP 165.227.45.151.22 > 174.91.38.241.63354: Flags [P.], seq 34124:34384, ack 1, win 319, length 260
10:41:38.854134 IP 165.227.45.151.22 > 174.91.38.241.63354: Flags [P.], seq 34384:34540, ack 1, win 319, length 156
10:41:38.854183 IP 165.227.45.151.22 > 174.91.38.241.63354: Flags [P.], seq 34540:34696, ack 1, win 319, length 156
10:41:38.854231 IP 165.227.45.151.22 > 174.91.38.241.63354: Flags [P.], seq 34696:34852, ack 1, win 319, length 156
10:41:38.854277 IP 165.227.45.151.22 > 174.91.38.241.63354: Flags [P.], seq 34852:35008, ack 1, win 319, length 156
10:41:38.854329 IP 165.227.45.151.22 > 174.91.38.241.63354: Flags [P.], seq 35008:35164, ack 1, win 319, length 156
10:41:38.854411 IP 165.227.45.151.22 > 174.91.38.241.63354: Flags [P.], seq 35164:35320, ack 1, win 319, length 156
10:41:38.856990 IP 174.91.38.241.63354 > 165.227.45.151.22: Flags [.], ack 27136, win 8288, length 0
10:41:38.857018 IP 165.227.45.151.22 > 174.91.38.241.63354: Flags [P.], seq 35320:35476, ack 1, win 319, length 156
10:41:38.857131 IP 165.227.45.151.22 > 174.91.38.241.63354: Flags [P.], seq 35476:35736, ack 1, win 319, length 260
10:41:38.857195 IP 165.227.45.151.22 > 174.91.38.241.63354: Flags [P.], seq 35736:35892, ack 1, win 319, length 156
10:41:38.857223 IP 174.91.38.241.63354 > 165.227.45.151.22: Flags [.], ack 28376, win 8289, length 0
10:41:38.857279 IP 165.227.45.151.22 > 174.91.38.241.63354: Flags [P.], seq 35892:36152, ack 1, win 319, length 260
10:41:38.857349 IP 165.227.45.151.22 > 174.91.38.241.63354: Flags [P.], seq 36152:36308, ack 1, win 319, length 156
10:41:38.857398 IP 165.227.45.151.22 > 174.91.38.241.63354: Flags [P.], seq 36308:36464, ack 1, win 319, length 156
10:41:38.857444 IP 174.91.38.241.63354 > 165.227.45.151.22: Flags [.], ack 27708, win 8292, length 0
10:41:38.857485 IP 165.227.45.151.22 > 174.91.38.241.63354: Flags [P.], seq 36464:36620, ack 1, win 319, length 156
10:41:38.857533 IP 165.227.45.151.22 > 174.91.38.241.63354: Flags [P.], seq 36620:36760, ack 1, win 319, length 140
10:41:38.857576 IP 165.227.45.151.22 > 174.91.38.241.63354: Flags [P.], seq 36760:36916, ack 1, win 319, length 156
10:41:38.857620 IP 165.227.45.151.22 > 174.91.38.241.63354: Flags [P.], seq 36916:37072, ack 1, win 319, length 156
10:41:38.857641 IP 165.227.45.151.22 > 174.91.38.241.63354: Flags [P.], seq 37072:37228, ack 1, win 319, length 156
10:41:38.857734 IP 174.91.38.241.63354 > 165.227.45.151.22: Flags [.], ack 29304, win 8292, length 0
10:41:38.857850 IP 165.227.45.151.22 > 174.91.38.241.63354: Flags [P.], seq 37228:37600, ack 1, win 319, length 372
10:41:38.857906 IP 165.227.45.151.22 > 174.91.38.241.63354: Flags [P.], seq 37600:37756, ack 1, win 319, length 156
10:41:38.857955 IP 165.227.45.151.22 > 174.91.38.241.63354: Flags [P.], seq 37756:37912, ack 1, win 319, length 156
10:41:38.858016 IP 165.227.45.151.22 > 174.91.38.241.63354: Flags [P.], seq 37912:38068, ack 1, win 319, length 156
10:41:38.858103 IP 165.227.45.151.22 > 174.91.38.241.63354: Flags [P.], seq 38068:38224, ack 1, win 319, length 156
10:41:38.858971 IP 174.91.38.241.63354 > 165.227.45.151.22: Flags [.], ack 31280, win 8292, length 0
10:41:38.858998 IP 165.227.45.151.22 > 174.91.38.241.63354: Flags [P.], seq 38224:38380, ack 1, win 319, length 156
10:41:38.859119 IP 165.227.45.151.22 > 174.91.38.241.63354: Flags [P.], seq 38380:38640, ack 1, win 319, length 260
10:41:38.859179 IP 165.227.45.151.22 > 174.91.38.241.63354: Flags [P.], seq 38640:38796, ack 1, win 319, length 156
10:41:38.859231 IP 165.227.45.151.22 > 174.91.38.241.63354: Flags [P.], seq 38796:38952, ack 1, win 319, length 156
10:41:38.859281 IP 165.227.45.151.22 > 174.91.38.241.63354: Flags [P.], seq 38952:39108, ack 1, win 319, length 156
10:41:38.859329 IP 165.227.45.151.22 > 174.91.38.241.63354: Flags [P.], seq 39108:39264, ack 1, win 319, length 156
10:41:38.859377 IP 165.227.45.151.22 > 174.91.38.241.63354: Flags [P.], seq 39264:39420, ack 1, win 319, length 156
10:41:38.859424 IP 165.227.45.151.22 > 174.91.38.241.63354: Flags [P.], seq 39420:39576, ack 1, win 319, length 156
10:41:38.859472 IP 165.227.45.151.22 > 174.91.38.241.63354: Flags [P.], seq 39576:39732, ack 1, win 319, length 156
10:41:38.859521 IP 165.227.45.151.22 > 174.91.38.241.63354: Flags [P.], seq 39732:39888, ack 1, win 319, length 156
10:41:38.859568 IP 165.227.45.151.22 > 174.91.38.241.63354: Flags [P.], seq 39888:40044, ack 1, win 319, length 156
10:41:38.859616 IP 165.227.45.151.22 > 174.91.38.241.63354: Flags [P.], seq 40044:40200, ack 1, win 319, length 156
10:41:38.861978 IP 174.91.38.241.63354 > 165.227.45.151.22: Flags [.], ack 31436, win 8291, length 0
10:41:38.861995 IP 165.227.45.151.22 > 174.91.38.241.63354: Flags [P.], seq 40200:40356, ack 1, win 319, length 156
10:41:38.873515 IP 174.91.38.241.63354 > 165.227.45.151.22: Flags [.], ack 32104, win 8289, length 0
10:41:38.873564 IP 165.227.45.151.22 > 174.91.38.241.63354: Flags [P.], seq 40356:40616, ack 1, win 319, length 260
10:41:38.873582 IP 174.91.38.241.63354 > 165.227.45.151.22: Flags [.], ack 33656, win 8292, length 0
10:41:38.873593 IP 174.91.38.241.63354 > 165.227.45.151.22: Flags [.], ack 34540, win 8288, length 0
10:41:38.873600 IP 174.91.38.241.63354 > 165.227.45.151.22: Flags [.], ack 40200, win 8291, length 0
10:41:38.873683 IP 174.91.38.241.63354 > 165.227.45.151.22: Flags [.], ack 40044, win 8292, length 0
10:41:38.873840 IP 165.227.45.151.22 > 174.91.38.241.63354: Flags [P.], seq 40616:41284, ack 1, win 319, length 668
10:41:38.873905 IP 165.227.45.151.22 > 174.91.38.241.63354: Flags [P.], seq 41284:41440, ack 1, win 319, length 156
10:41:38.873964 IP 165.227.45.151.22 > 174.91.38.241.63354: Flags [P.], seq 41440:41596, ack 1, win 319, length 156
10:41:38.874003 IP 174.91.38.241.63354 > 165.227.45.151.22: Flags [.], ack 38952, win 8287, length 0
10:41:38.874009 IP 174.91.38.241.63354 > 165.227.45.151.22: Flags [.], ack 38380, win 8289, length 0
10:41:38.874071 IP 165.227.45.151.22 > 174.91.38.241.63354: Flags [P.], seq 41596:41952, ack 1, win 319, length 356
10:41:38.874129 IP 165.227.45.151.22 > 174.91.38.241.63354: Flags [P.], seq 41952:42108, ack 1, win 319, length 156
10:41:38.874179 IP 165.227.45.151.22 > 174.91.38.241.63354: Flags [P.], seq 42108:42264, ack 1, win 319, length 156
10:41:38.874199 IP 174.91.38.241.63354 > 165.227.45.151.22: Flags [.], ack 37756, win 8292, length 0
10:41:38.874203 IP 174.91.38.241.63354 > 165.227.45.151.22: Flags [.], ack 36464, win 8287, length 0
10:41:38.874265 IP 165.227.45.151.22 > 174.91.38.241.63354: Flags [P.], seq 42264:42620, ack 1, win 319, length 356
10:41:38.874331 IP 165.227.45.151.22 > 174.91.38.241.63354: Flags [P.], seq 42620:42776, ack 1, win 319, length 156
10:41:38.874381 IP 165.227.45.151.22 > 174.91.38.241.63354: Flags [P.], seq 42776:42932, ack 1, win 319, length 156
10:41:38.874430 IP 165.227.45.151.22 > 174.91.38.241.63354: Flags [P.], seq 42932:43088, ack 1, win 319, length 156
10:41:38.874447 IP 174.91.38.241.63354 > 165.227.45.151.22: Flags [.], ack 35320, win 8292, length 0
10:41:38.874523 IP 165.227.45.151.22 > 174.91.38.241.63354: Flags [P.], seq 43088:43348, ack 1, win 319, length 260
10:41:38.874576 IP 165.227.45.151.22 > 174.91.38.241.63354: Flags [P.], seq 43348:43504, ack 1, win 319, length 156
10:41:38.874624 IP 165.227.45.151.22 > 174.91.38.241.63354: Flags [P.], seq 43504:43660, ack 1, win 319, length 156
10:41:38.874671 IP 165.227.45.151.22 > 174.91.38.241.63354: Flags [P.], seq 43660:43816, ack 1, win 319, length 156
10:41:38.874691 IP 174.91.38.241.63354 > 165.227.45.151.22: Flags [.], ack 35008, win 8287, length 0
10:41:38.874696 IP 174.91.38.241.63354 > 165.227.45.151.22: Flags [.], ack 33968, win 8291, length 0
10:41:38.874757 IP 165.227.45.151.22 > 174.91.38.241.63354: Flags [P.], seq 43816:44172, ack 1, win 319, length 356
10:41:38.874812 IP 165.227.45.151.22 > 174.91.38.241.63354: Flags [P.], seq 44172:44328, ack 1, win 319, length 156
10:41:38.874861 IP 165.227.45.151.22 > 174.91.38.241.63354: Flags [P.], seq 44328:44484, ack 1, win 319, length 156
10:41:38.874908 IP 165.227.45.151.22 > 174.91.38.241.63354: Flags [P.], seq 44484:44640, ack 1, win 319, length 156
10:41:38.874945 IP 174.91.38.241.63354 > 165.227.45.151.22: Flags [P.], seq 1:37, ack 33968, win 8291, length 36
10:41:38.875002 IP 165.227.45.151.22 > 174.91.38.241.63354: Flags [P.], seq 44640:44908, ack 37, win 319, length 268
10:41:38.875055 IP 165.227.45.151.22 > 174.91.38.241.63354: Flags [P.], seq 44908:45064, ack 37, win 319, length 156
10:41:38.875114 IP 165.227.45.151.22 > 174.91.38.241.63354: Flags [P.], seq 45064:45220, ack 37, win 319, length 156
10:41:38.875161 IP 165.227.45.151.22 > 174.91.38.241.63354: Flags [P.], seq 45220:45376, ack 37, win 319, length 156
10:41:38.875208 IP 165.227.45.151.22 > 174.91.38.241.63354: Flags [P.], seq 45376:45532, ack 37, win 319, length 156
10:41:38.875255 IP 165.227.45.151.22 > 174.91.38.241.63354: Flags [P.], seq 45532:45688, ack 37, win 319, length 156
10:41:38.875309 IP 165.227.45.151.22 > 174.91.38.241.63354: Flags [P.], seq 45688:45844, ack 37, win 319, length 156
10:41:38.875386 IP 165.227.45.151.22 > 174.91.38.241.63354: Flags [P.], seq 45844:46000, ack 37, win 319, length 156
10:41:38.875456 IP 165.227.45.151.22 > 174.91.38.241.63354: Flags [P.], seq 46000:46156, ack 37, win 319, length 156
10:41:38.875507 IP 165.227.45.151.22 > 174.91.38.241.63354: Flags [P.], seq 46156:46312, ack 37, win 319, length 156
10:41:38.875556 IP 165.227.45.151.22 > 174.91.38.241.63354: Flags [P.], seq 46312:46468, ack 37, win 319, length 156
10:41:38.875603 IP 165.227.45.151.22 > 174.91.38.241.63354: Flags [P.], seq 46468:46624, ack 37, win 319, length 156
10:41:38.875651 IP 165.227.45.151.22 > 174.91.38.241.63354: Flags [P.], seq 46624:46780, ack 37, win 319, length 156
10:41:38.875698 IP 165.227.45.151.22 > 174.91.38.241.63354: Flags [P.], seq 46780:46936, ack 37, win 319, length 156
10:41:38.875754 IP 165.227.45.151.22 > 174.91.38.241.63354: Flags [P.], seq 46936:47092, ack 37, win 319, length 156
10:41:38.875812 IP 165.227.45.151.22 > 174.91.38.241.63354: Flags [P.], seq 47092:47248, ack 37, win 319, length 156
10:41:38.875861 IP 165.227.45.151.22 > 174.91.38.241.63354: Flags [P.], seq 47248:47404, ack 37, win 319, length 156
10:41:38.875910 IP 165.227.45.151.22 > 174.91.38.241.63354: Flags [P.], seq 47404:47560, ack 37, win 319, length 156
10:41:38.875957 IP 165.227.45.151.22 > 174.91.38.241.63354: Flags [P.], seq 47560:47716, ack 37, win 319, length 156
10:41:38.876004 IP 165.227.45.151.22 > 174.91.38.241.63354: Flags [P.], seq 47716:47872, ack 37, win 319, length 156
10:41:38.876052 IP 165.227.45.151.22 > 174.91.38.241.63354: Flags [P.], seq 47872:48028, ack 37, win 319, length 156
10:41:38.876099 IP 165.227.45.151.22 > 174.91.38.241.63354: Flags [P.], seq 48028:48184, ack 37, win 319, length 156
10:41:38.876147 IP 165.227.45.151.22 > 174.91.38.241.63354: Flags [P.], seq 48184:48340, ack 37, win 319, length 156
10:41:38.876194 IP 165.227.45.151.22 > 174.91.38.241.63354: Flags [P.], seq 48340:48496, ack 37, win 319, length 156
10:41:38.876250 IP 165.227.45.151.22 > 174.91.38.241.63354: Flags [P.], seq 48496:48652, ack 37, win 319, length 156
10:41:38.876298 IP 165.227.45.151.22 > 174.91.38.241.63354: Flags [P.], seq 48652:48808, ack 37, win 319, length 156
10:41:38.876345 IP 165.227.45.151.22 > 174.91.38.241.63354: Flags [P.], seq 48808:48964, ack 37, win 319, length 156
10:41:38.876392 IP 165.227.45.151.22 > 174.91.38.241.63354: Flags [P.], seq 48964:49120, ack 37, win 319, length 156
10:41:38.876439 IP 165.227.45.151.22 > 174.91.38.241.63354: Flags [P.], seq 49120:49276, ack 37, win 319, length 156
10:41:38.876486 IP 165.227.45.151.22 > 174.91.38.241.63354: Flags [P.], seq 49276:49432, ack 37, win 319, length 156
10:41:38.876538 IP 165.227.45.151.22 > 174.91.38.241.63354: Flags [P.], seq 49432:49588, ack 37, win 319, length 156
10:41:38.885769 IP 174.91.38.241.63354 > 165.227.45.151.22: Flags [.], ack 41284, win 8287, length 0
10:41:38.885838 IP 165.227.45.151.22 > 174.91.38.241.63354: Flags [P.], seq 49588:49744, ack 37, win 319, length 156
10:41:38.886094 IP 165.227.45.151.22 > 174.91.38.241.63354: Flags [P.], seq 49744:50004, ack 37, win 319, length 260
10:41:38.886157 IP 165.227.45.151.22 > 174.91.38.241.63354: Flags [P.], seq 50004:50160, ack 37, win 319, length 156
10:41:38.888973 IP 174.91.38.241.63354 > 165.227.45.151.22: Flags [.], ack 43088, win 8289, length 0
10:41:38.888997 IP 165.227.45.151.22 > 174.91.38.241.63354: Flags [P.], seq 50160:50316, ack 37, win 319, length 156
10:41:38.889096 IP 165.227.45.151.22 > 174.91.38.241.63354: Flags [P.], seq 50316:50576, ack 37, win 319, length 260
10:41:38.889158 IP 165.227.45.151.22 > 174.91.38.241.63354: Flags [P.], seq 50576:50732, ack 37, win 319, length 156
10:41:38.889212 IP 165.227.45.151.22 > 174.91.38.241.63354: Flags [P.], seq 50732:50888, ack 37, win 319, length 156
10:41:38.889240 IP 174.91.38.241.63354 > 165.227.45.151.22: Flags [.], ack 42264, win 8292, length 0
10:41:38.889322 IP 165.227.45.151.22 > 174.91.38.241.63354: Flags [P.], seq 50888:51148, ack 37, win 319, length 260
10:41:38.889378 IP 165.227.45.151.22 > 174.91.38.241.63354: Flags [P.], seq 51148:51304, ack 37, win 319, length 156
10:41:38.889446 IP 165.227.45.151.22 > 174.91.38.241.63354: Flags [P.], seq 51304:51460, ack 37, win 319, length 156
10:41:38.889502 IP 165.227.45.151.22 > 174.91.38.241.63354: Flags [P.], seq 51460:51616, ack 37, win 319, length 156
10:41:38.889560 IP 165.227.45.151.22 > 174.91.38.241.63354: Flags [P.], seq 51616:51772, ack 37, win 319, length 156
10:41:38.890206 IP 174.91.38.241.63354 > 165.227.45.151.22: Flags [.], ack 43504, win 8287, length 0
10:41:38.890220 IP 165.227.45.151.22 > 174.91.38.241.63354: Flags [P.], seq 51772:51928, ack 37, win 319, length 156
10:41:38.890304 IP 165.227.45.151.22 > 174.91.38.241.63354: Flags [P.], seq 51928:52188, ack 37, win 319, length 260
10:41:38.890740 IP 174.91.38.241.63354 > 165.227.45.151.22: Flags [.], ack 45532, win 8292, length 0
10:41:38.890761 IP 165.227.45.151.22 > 174.91.38.241.63354: Flags [P.], seq 52188:52344, ack 37, win 319, length 156
10:41:38.890846 IP 165.227.45.151.22 > 174.91.38.241.63354: Flags [P.], seq 52344:52604, ack 37, win 319, length 260
10:41:38.890910 IP 165.227.45.151.22 > 174.91.38.241.63354: Flags [P.], seq 52604:52760, ack 37, win 319, length 156
10:41:38.890955 IP 174.91.38.241.63354 > 165.227.45.151.22: Flags [.], ack 48340, win 8292, length 0
10:41:38.891018 IP 165.227.45.151.22 > 174.91.38.241.63354: Flags [P.], seq 52760:53020, ack 37, win 319, length 260
10:41:38.891069 IP 165.227.45.151.22 > 174.91.38.241.63354: Flags [P.], seq 53020:53176, ack 37, win 319, length 156
10:41:38.891120 IP 165.227.45.151.22 > 174.91.38.241.63354: Flags [P.], seq 53176:53332, ack 37, win 319, length 156
10:41:38.891169 IP 165.227.45.151.22 > 174.91.38.241.63354: Flags [P.], seq 53332:53488, ack 37, win 319, length 156
10:41:38.891200 IP 174.91.38.241.63354 > 165.227.45.151.22: Flags [.], ack 49588, win 8287, length 0
10:41:38.891253 IP 165.227.45.151.22 > 174.91.38.241.63354: Flags [P.], seq 53488:53748, ack 37, win 319, length 260
10:41:38.891306 IP 165.227.45.151.22 > 174.91.38.241.63354: Flags [P.], seq 53748:53904, ack 37, win 319, length 156
10:41:38.891354 IP 165.227.45.151.22 > 174.91.38.241.63354: Flags [P.], seq 53904:54060, ack 37, win 319, length 156
10:41:38.891401 IP 165.227.45.151.22 > 174.91.38.241.63354: Flags [P.], seq 54060:54216, ack 37, win 319, length 156
10:41:38.891448 IP 165.227.45.151.22 > 174.91.38.241.63354: Flags [P.], seq 54216:54372, ack 37, win 319, length 156
10:41:38.891495 IP 165.227.45.151.22 > 174.91.38.241.63354: Flags [P.], seq 54372:54528, ack 37, win 319, length 156
10:41:38.891542 IP 165.227.45.151.22 > 174.91.38.241.63354: Flags [P.], seq 54528:54684, ack 37, win 319, length 156
10:41:38.891596 IP 165.227.45.151.22 > 174.91.38.241.63354: Flags [P.], seq 54684:54840, ack 37, win 319, length 156
10:41:38.891660 IP 165.227.45.151.22 > 174.91.38.241.63354: Flags [P.], seq 54840:54996, ack 37, win 319, length 156
10:41:38.891711 IP 165.227.45.151.22 > 174.91.38.241.63354: Flags [P.], seq 54996:55152, ack 37, win 319, length 156
10:41:38.891760 IP 165.227.45.151.22 > 174.91.38.241.63354: Flags [P.], seq 55152:55308, ack 37, win 319, length 156
10:41:38.891807 IP 165.227.45.151.22 > 174.91.38.241.63354: Flags [P.], seq 55308:55464, ack 37, win 319, length 156
10:41:38.891869 IP 165.227.45.151.22 > 174.91.38.241.63354: Flags [P.], seq 55464:55620, ack 37, win 319, length 156
10:41:38.891920 IP 165.227.45.151.22 > 174.91.38.241.63354: Flags [P.], seq 55620:55776, ack 37, win 319, length 156
10:41:38.891974 IP 165.227.45.151.22 > 174.91.38.241.63354: Flags [P.], seq 55776:55932, ack 37, win 319, length 156
10:41:38.892023 IP 165.227.45.151.22 > 174.91.38.241.63354: Flags [P.], seq 55932:56088, ack 37, win 319, length 156
10:41:38.892071 IP 165.227.45.151.22 > 174.91.38.241.63354: Flags [P.], seq 56088:56244, ack 37, win 319, length 156
10:41:38.892132 IP 165.227.45.151.22 > 174.91.38.241.63354: Flags [P.], seq 56244:56400, ack 37, win 319, length 156
10:41:38.892180 IP 165.227.45.151.22 > 174.91.38.241.63354: Flags [P.], seq 56400:56556, ack 37, win 319, length 156
10:41:38.892228 IP 165.227.45.151.22 > 174.91.38.241.63354: Flags [P.], seq 56556:56712, ack 37, win 319, length 156
10:41:38.892275 IP 165.227.45.151.22 > 174.91.38.241.63354: Flags [P.], seq 56712:56868, ack 37, win 319, length 156
10:41:38.892322 IP 165.227.45.151.22 > 174.91.38.241.63354: Flags [P.], seq 56868:57024, ack 37, win 319, length 156
10:41:38.892375 IP 165.227.45.151.22 > 174.91.38.241.63354: Flags [P.], seq 57024:57180, ack 37, win 319, length 156
10:41:38.892426 IP 165.227.45.151.22 > 174.91.38.241.63354: Flags [P.], seq 57180:57336, ack 37, win 319, length 156
10:41:38.892473 IP 165.227.45.151.22 > 174.91.38.241.63354: Flags [P.], seq 57336:57492, ack 37, win 319, length 156
10:41:38.892521 IP 165.227.45.151.22 > 174.91.38.241.63354: Flags [P.], seq 57492:57648, ack 37, win 319, length 156
10:41:38.892577 IP 165.227.45.151.22 > 174.91.38.241.63354: Flags [P.], seq 57648:57804, ack 37, win 319, length 156
10:41:38.892626 IP 165.227.45.151.22 > 174.91.38.241.63354: Flags [P.], seq 57804:57960, ack 37, win 319, length 156
10:41:38.892673 IP 165.227.45.151.22 > 174.91.38.241.63354: Flags [P.], seq 57960:58116, ack 37, win 319, length 156
10:41:38.892720 IP 165.227.45.151.22 > 174.91.38.241.63354: Flags [P.], seq 58116:58272, ack 37, win 319, length 156
10:41:38.894486 IP 174.91.38.241.63354 > 165.227.45.151.22: Flags [.], ack 50004, win 8292, length 0
10:41:38.894514 IP 165.227.45.151.22 > 174.91.38.241.63354: Flags [P.], seq 58272:58428, ack 37, win 319, length 156
10:41:38.894530 IP 174.91.38.241.63354 > 165.227.45.151.22: Flags [.], ack 50160, win 8291, length 0
10:41:38.894663 IP 165.227.45.151.22 > 174.91.38.241.63354: Flags [P.], seq 58428:58784, ack 37, win 319, length 356
10:41:38.894729 IP 165.227.45.151.22 > 174.91.38.241.63354: Flags [P.], seq 58784:58940, ack 37, win 319, length 156
10:41:38.901772 IP 174.91.38.241.63354 > 165.227.45.151.22: Flags [.], ack 50888, win 8288, length 0
10:41:38.901810 IP 165.227.45.151.22 > 174.91.38.241.63354: Flags [P.], seq 58940:59096, ack 37, win 319, length 156
10:41:38.901967 IP 165.227.45.151.22 > 174.91.38.241.63354: Flags [P.], seq 59096:59356, ack 37, win 319, length 260
10:41:38.902042 IP 165.227.45.151.22 > 174.91.38.241.63354: Flags [P.], seq 59356:59512, ack 37, win 319, length 156
10:41:38.902100 IP 165.227.45.151.22 > 174.91.38.241.63354: Flags [P.], seq 59512:59668, ack 37, win 319, length 156
10:41:38.905767 IP 174.91.38.241.63354 > 165.227.45.151.22: Flags [.], ack 51460, win 8292, length 0
10:41:38.905792 IP 165.227.45.151.22 > 174.91.38.241.63354: Flags [P.], seq 59668:59824, ack 37, win 319, length 156
10:41:38.905807 IP 174.91.38.241.63354 > 165.227.45.151.22: Flags [.], ack 54216, win 8292, length 0
10:41:38.905930 IP 165.227.45.151.22 > 174.91.38.241.63354: Flags [P.], seq 59824:60180, ack 37, win 319, length 356
10:41:38.905953 IP 174.91.38.241.63354 > 165.227.45.151.22: Flags [.], ack 58272, win 8288, length 0
10:41:38.906034 IP 165.227.45.151.22 > 174.91.38.241.63354: Flags [P.], seq 60180:60440, ack 37, win 319, length 260
10:41:38.906104 IP 165.227.45.151.22 > 174.91.38.241.63354: Flags [P.], seq 60440:60596, ack 37, win 319, length 156
10:41:38.906165 IP 165.227.45.151.22 > 174.91.38.241.63354: Flags [P.], seq 60596:60752, ack 37, win 319, length 156
10:41:38.906225 IP 174.91.38.241.63354 > 165.227.45.151.22: Flags [.], ack 57180, win 8292, length 0
10:41:38.906232 IP 174.91.38.241.63354 > 165.227.45.151.22: Flags [.], ack 54684, win 8290, length 0
10:41:38.906272 IP 165.227.45.151.22 > 174.91.38.241.63354: Flags [P.], seq 60752:60908, ack 37, win 319, length 156
10:41:38.906331 IP 165.227.45.151.22 > 174.91.38.241.63354: Flags [P.], seq 60908:61264, ack 37, win 319, length 356
10:41:38.906407 IP 165.227.45.151.22 > 174.91.38.241.63354: Flags [P.], seq 61264:61420, ack 37, win 319, length 156
10:41:38.906451 IP 174.91.38.241.63354 > 165.227.45.151.22: Flags [.], ack 52344, win 8288, length 0
10:41:38.906456 IP 174.91.38.241.63354 > 165.227.45.151.22: Flags [.], ack 52188, win 8289, length 0
10:41:38.906553 IP 165.227.45.151.22 > 174.91.38.241.63354: Flags [P.], seq 61420:61776, ack 37, win 319, length 356
10:41:38.906616 IP 165.227.45.151.22 > 174.91.38.241.63354: Flags [P.], seq 61776:61932, ack 37, win 319, length 156
10:41:38.906667 IP 165.227.45.151.22 > 174.91.38.241.63354: Flags [P.], seq 61932:62088, ack 37, win 319, length 156
10:41:38.906712 IP 174.91.38.241.63354 > 165.227.45.151.22: Flags [.], ack 58940, win 8292, length 0
10:41:38.906759 IP 165.227.45.151.22 > 174.91.38.241.63354: Flags [P.], seq 62088:62348, ack 37, win 319, length 260
10:41:38.906827 IP 165.227.45.151.22 > 174.91.38.241.63354: Flags [P.], seq 62348:62504, ack 37, win 319, length 156
10:41:38.906883 IP 165.227.45.151.22 > 174.91.38.241.63354: Flags [P.], seq 62504:62660, ack 37, win 319, length 156
10:41:38.906935 IP 165.227.45.151.22 > 174.91.38.241.63354: Flags [P.], seq 62660:62816, ack 37, win 319, length 156
10:41:38.906984 IP 165.227.45.151.22 > 174.91.38.241.63354: Flags [P.], seq 62816:62972, ack 37, win 319, length 156
10:41:38.907032 IP 165.227.45.151.22 > 174.91.38.241.63354: Flags [P.], seq 62972:63128, ack 37, win 319, length 156
10:41:38.907096 IP 165.227.45.151.22 > 174.91.38.241.63354: Flags [P.], seq 63128:63284, ack 37, win 319, length 156
10:41:38.907148 IP 165.227.45.151.22 > 174.91.38.241.63354: Flags [P.], seq 63284:63440, ack 37, win 319, length 156
10:41:38.907207 IP 165.227.45.151.22 > 174.91.38.241.63354: Flags [P.], seq 63440:63596, ack 37, win 319, length 156
10:41:38.907246 IP 165.227.45.151.22 > 174.91.38.241.63354: Flags [P.], seq 63596:63752, ack 37, win 319, length 156
10:41:38.907294 IP 165.227.45.151.22 > 174.91.38.241.63354: Flags [P.], seq 63752:63908, ack 37, win 319, length 156
10:41:38.907342 IP 165.227.45.151.22 > 174.91.38.241.63354: Flags [P.], seq 63908:64064, ack 37, win 319, length 156
10:41:38.907398 IP 165.227.45.151.22 > 174.91.38.241.63354: Flags [P.], seq 64064:64220, ack 37, win 319, length 156
10:41:38.907450 IP 165.227.45.151.22 > 174.91.38.241.63354: Flags [P.], seq 64220:64376, ack 37, win 319, length 156
10:41:38.907488 IP 165.227.45.151.22 > 174.91.38.241.63354: Flags [P.], seq 64376:64532, ack 37, win 319, length 156
10:41:38.907535 IP 165.227.45.151.22 > 174.91.38.241.63354: Flags [P.], seq 64532:64688, ack 37, win 319, length 156
10:41:38.907583 IP 165.227.45.151.22 > 174.91.38.241.63354: Flags [P.], seq 64688:64844, ack 37, win 319, length 156
10:41:38.907631 IP 165.227.45.151.22 > 174.91.38.241.63354: Flags [P.], seq 64844:65000, ack 37, win 319, length 156
10:41:38.907678 IP 165.227.45.151.22 > 174.91.38.241.63354: Flags [P.], seq 65000:65156, ack 37, win 319, length 156
10:41:38.907726 IP 165.227.45.151.22 > 174.91.38.241.63354: Flags [P.], seq 65156:65312, ack 37, win 319, length 156
10:41:38.907775 IP 165.227.45.151.22 > 174.91.38.241.63354: Flags [P.], seq 65312:65468, ack 37, win 319, length 156
10:41:38.907822 IP 165.227.45.151.22 > 174.91.38.241.63354: Flags [P.], seq 65468:65624, ack 37, win 319, length 156
10:41:38.907873 IP 165.227.45.151.22 > 174.91.38.241.63354: Flags [P.], seq 65624:65780, ack 37, win 319, length 156
10:41:38.907929 IP 165.227.45.151.22 > 174.91.38.241.63354: Flags [P.], seq 65780:65936, ack 37, win 319, length 156
10:41:38.907980 IP 165.227.45.151.22 > 174.91.38.241.63354: Flags [P.], seq 65936:66092, ack 37, win 319, length 156
10:41:38.908028 IP 165.227.45.151.22 > 174.91.38.241.63354: Flags [P.], seq 66092:66248, ack 37, win 319, length 156
10:41:38.908076 IP 165.227.45.151.22 > 174.91.38.241.63354: Flags [P.], seq 66248:66404, ack 37, win 319, length 156
10:41:38.908124 IP 165.227.45.151.22 > 174.91.38.241.63354: Flags [P.], seq 66404:66560, ack 37, win 319, length 156
10:41:38.908172 IP 165.227.45.151.22 > 174.91.38.241.63354: Flags [P.], seq 66560:66716, ack 37, win 319, length 156
10:41:38.908219 IP 165.227.45.151.22 > 174.91.38.241.63354: Flags [P.], seq 66716:66872, ack 37, win 319, length 156
10:41:38.908267 IP 165.227.45.151.22 > 174.91.38.241.63354: Flags [P.], seq 66872:67028, ack 37, win 319, length 156
10:41:38.908314 IP 165.227.45.151.22 > 174.91.38.241.63354: Flags [P.], seq 67028:67184, ack 37, win 319, length 156
10:41:38.908362 IP 165.227.45.151.22 > 174.91.38.241.63354: Flags [P.], seq 67184:67340, ack 37, win 319, length 156
10:41:38.908410 IP 165.227.45.151.22 > 174.91.38.241.63354: Flags [P.], seq 67340:67496, ack 37, win 319, length 156
10:41:38.908458 IP 165.227.45.151.22 > 174.91.38.241.63354: Flags [P.], seq 67496:67652, ack 37, win 319, length 156
10:41:38.908506 IP 165.227.45.151.22 > 174.91.38.241.63354: Flags [P.], seq 67652:67808, ack 37, win 319, length 156
10:41:38.910987 IP 174.91.38.241.63354 > 165.227.45.151.22: Flags [.], ack 59668, win 8289, length 0
10:41:38.911004 IP 165.227.45.151.22 > 174.91.38.241.63354: Flags [P.], seq 67808:67964, ack 37, win 319, length 156
10:41:38.911098 IP 165.227.45.151.22 > 174.91.38.241.63354: Flags [P.], seq 67964:68224, ack 37, win 319, length 260
10:41:38.911166 IP 165.227.45.151.22 > 174.91.38.241.63354: Flags [P.], seq 68224:68380, ack 37, win 319, length 156
10:41:38.911206 IP 174.91.38.241.63354 > 165.227.45.151.22: Flags [.], ack 59356, win 8290, length 0
10:41:38.911255 IP 165.227.45.151.22 > 174.91.38.241.63354: Flags [P.], seq 68380:68640, ack 37, win 319, length 260
10:41:38.920012 IP 174.91.38.241.63354 > 165.227.45.151.22: Flags [.], ack 62660, win 8289, length 0
10:41:38.920048 IP 165.227.45.151.22 > 174.91.38.241.63354: Flags [P.], seq 68640:68796, ack 37, win 319, length 156
10:41:38.920177 IP 165.227.45.151.22 > 174.91.38.241.63354: Flags [P.], seq 68796:69056, ack 37, win 319, length 260
10:41:38.920210 IP 174.91.38.241.63354 > 165.227.45.151.22: Flags [.], ack 61932, win 8292, length 0
10:41:38.920217 IP 174.91.38.241.63354 > 165.227.45.151.22: Flags [.], ack 61420, win 8288, length 0
10:41:38.920219 IP 174.91.38.241.63354 > 165.227.45.151.22: Flags [.], ack 60440, win 8292, length 0
10:41:38.920291 IP 165.227.45.151.22 > 174.91.38.241.63354: Flags [P.], seq 69056:69516, ack 37, win 319, length 460
10:41:38.920363 IP 165.227.45.151.22 > 174.91.38.241.63354: Flags [P.], seq 69516:69672, ack 37, win 319, length 156
10:41:38.920443 IP 165.227.45.151.22 > 174.91.38.241.63354: Flags [P.], seq 69672:69828, ack 37, win 319, length 156
10:41:38.920533 IP 165.227.45.151.22 > 174.91.38.241.63354: Flags [P.], seq 69828:69984, ack 37, win 319, length 156
10:41:38.920604 IP 165.227.45.151.22 > 174.91.38.241.63354: Flags [P.], seq 69984:70140, ack 37, win 319, length 156
10:41:38.920658 IP 165.227.45.151.22 > 174.91.38.241.63354: Flags [P.], seq 70140:70296, ack 37, win 319, length 156
10:41:38.920697 IP 165.227.45.151.22 > 174.91.38.241.63354: Flags [P.], seq 70296:70452, ack 37, win 319, length 156
10:41:38.920747 IP 165.227.45.151.22 > 174.91.38.241.63354: Flags [P.], seq 70452:70608, ack 37, win 319, length 156
10:41:38.920795 IP 165.227.45.151.22 > 174.91.38.241.63354: Flags [P.], seq 70608:70764, ack 37, win 319, length 156
10:41:38.920843 IP 165.227.45.151.22 > 174.91.38.241.63354: Flags [P.], seq 70764:70920, ack 37, win 319, length 156
10:41:38.920891 IP 165.227.45.151.22 > 174.91.38.241.63354: Flags [P.], seq 70920:71076, ack 37, win 319, length 156
10:41:38.920938 IP 165.227.45.151.22 > 174.91.38.241.63354: Flags [P.], seq 71076:71232, ack 37, win 319, length 156
10:41:38.920963 IP 174.91.38.241.63354 > 165.227.45.151.22: Flags [.], ack 64064, win 8292, length 0
10:41:38.921030 IP 165.227.45.151.22 > 174.91.38.241.63354: Flags [P.], seq 71232:71492, ack 37, win 319, length 260
10:41:38.921085 IP 165.227.45.151.22 > 174.91.38.241.63354: Flags [P.], seq 71492:71648, ack 37, win 319, length 156
10:41:38.921134 IP 165.227.45.151.22 > 174.91.38.241.63354: Flags [P.], seq 71648:71804, ack 37, win 319, length 156
10:41:38.921199 IP 165.227.45.151.22 > 174.91.38.241.63354: Flags [P.], seq 71804:71960, ack 37, win 319, length 156
10:41:38.921259 IP 165.227.45.151.22 > 174.91.38.241.63354: Flags [P.], seq 71960:72116, ack 37, win 319, length 156
10:41:38.921328 IP 165.227.45.151.22 > 174.91.38.241.63354: Flags [P.], seq 72116:72272, ack 37, win 319, length 156
10:41:38.921381 IP 165.227.45.151.22 > 174.91.38.241.63354: Flags [P.], seq 72272:72428, ack 37, win 319, length 156
10:41:38.921430 IP 165.227.45.151.22 > 174.91.38.241.63354: Flags [P.], seq 72428:72584, ack 37, win 319, length 156
10:41:38.921478 IP 165.227.45.151.22 > 174.91.38.241.63354: Flags [P.], seq 72584:72740, ack 37, win 319, length 156
10:41:38.921526 IP 165.227.45.151.22 > 174.91.38.241.63354: Flags [P.], seq 72740:72896, ack 37, win 319, length 156
10:41:38.923480 IP 174.91.38.241.63354 > 165.227.45.151.22: Flags [.], ack 67028, win 8292, length 0
10:41:38.923507 IP 165.227.45.151.22 > 174.91.38.241.63354: Flags [P.], seq 72896:73052, ack 37, win 319, length 156
10:41:38.923607 IP 165.227.45.151.22 > 174.91.38.241.63354: Flags [P.], seq 73052:73312, ack 37, win 319, length 260
10:41:38.923681 IP 165.227.45.151.22 > 174.91.38.241.63354: Flags [P.], seq 73312:73468, ack 37, win 319, length 156
10:41:38.923707 IP 174.91.38.241.63354 > 165.227.45.151.22: Flags [.], ack 68640, win 8292, length 0
10:41:38.923719 IP 174.91.38.241.63354 > 165.227.45.151.22: Flags [.], ack 67652, win 8289, length 0
10:41:38.923790 IP 165.227.45.151.22 > 174.91.38.241.63354: Flags [P.], seq 73468:73824, ack 37, win 319, length 356
10:41:38.923849 IP 165.227.45.151.22 > 174.91.38.241.63354: Flags [P.], seq 73824:73980, ack 37, win 319, length 156
10:41:38.923900 IP 165.227.45.151.22 > 174.91.38.241.63354: Flags [P.], seq 73980:74136, ack 37, win 319, length 156
10:41:38.923949 IP 165.227.45.151.22 > 174.91.38.241.63354: Flags [P.], seq 74136:74292, ack 37, win 319, length 156
10:41:38.924001 IP 165.227.45.151.22 > 174.91.38.241.63354: Flags [P.], seq 74292:74448, ack 37, win 319, length 156
10:41:38.924049 IP 165.227.45.151.22 > 174.91.38.241.63354: Flags [P.], seq 74448:74604, ack 37, win 319, length 156
10:41:38.924124 IP 165.227.45.151.22 > 174.91.38.241.63354: Flags [P.], seq 74604:74760, ack 37, win 319, length 156
10:41:38.924206 IP 165.227.45.151.22 > 174.91.38.241.63354: Flags [P.], seq 74760:74916, ack 37, win 319, length 156
10:41:38.924263 IP 165.227.45.151.22 > 174.91.38.241.63354: Flags [P.], seq 74916:75072, ack 37, win 319, length 156
10:41:38.924311 IP 165.227.45.151.22 > 174.91.38.241.63354: Flags [P.], seq 75072:75228, ack 37, win 319, length 156
10:41:38.924360 IP 165.227.45.151.22 > 174.91.38.241.63354: Flags [P.], seq 75228:75384, ack 37, win 319, length 156
10:41:38.924408 IP 165.227.45.151.22 > 174.91.38.241.63354: Flags [P.], seq 75384:75540, ack 37, win 319, length 156
10:41:38.924456 IP 165.227.45.151.22 > 174.91.38.241.63354: Flags [P.], seq 75540:75696, ack 37, win 319, length 156
10:41:38.924505 IP 165.227.45.151.22 > 174.91.38.241.63354: Flags [P.], seq 75696:75852, ack 37, win 319, length 156
10:41:38.924553 IP 165.227.45.151.22 > 174.91.38.241.63354: Flags [P.], seq 75852:76008, ack 37, win 319, length 156
10:41:38.924604 IP 165.227.45.151.22 > 174.91.38.241.63354: Flags [P.], seq 76008:76164, ack 37, win 319, length 156
10:41:38.924652 IP 165.227.45.151.22 > 174.91.38.241.63354: Flags [P.], seq 76164:76320, ack 37, win 319, length 156
10:41:38.924700 IP 165.227.45.151.22 > 174.91.38.241.63354: Flags [P.], seq 76320:76476, ack 37, win 319, length 156
10:41:38.924748 IP 165.227.45.151.22 > 174.91.38.241.63354: Flags [P.], seq 76476:76632, ack 37, win 319, length 156
10:41:38.924796 IP 165.227.45.151.22 > 174.91.38.241.63354: Flags [P.], seq 76632:76788, ack 37, win 319, length 156
10:41:38.924844 IP 165.227.45.151.22 > 174.91.38.241.63354: Flags [P.], seq 76788:76944, ack 37, win 319, length 156
10:41:38.924912 IP 165.227.45.151.22 > 174.91.38.241.63354: Flags [P.], seq 76944:77100, ack 37, win 319, length 156
10:41:38.924977 IP 165.227.45.151.22 > 174.91.38.241.63354: Flags [P.], seq 77100:77256, ack 37, win 319, length 156
10:41:38.925041 IP 165.227.45.151.22 > 174.91.38.241.63354: Flags [P.], seq 77256:77412, ack 37, win 319, length 156
10:41:38.925092 IP 165.227.45.151.22 > 174.91.38.241.63354: Flags [P.], seq 77412:77568, ack 37, win 319, length 156
10:41:38.931230 IP 174.91.38.241.63354 > 165.227.45.151.22: Flags [.], ack 69056, win 8290, length 0
10:41:38.931263 IP 165.227.45.151.22 > 174.91.38.241.63354: Flags [P.], seq 77568:77724, ack 37, win 319, length 156
10:41:38.931397 IP 165.227.45.151.22 > 174.91.38.241.63354: Flags [P.], seq 77724:77984, ack 37, win 319, length 260
10:41:38.931464 IP 174.91.38.241.63354 > 165.227.45.151.22: Flags [.], ack 69672, win 8288, length 0
10:41:38.931473 IP 165.227.45.151.22 > 174.91.38.241.63354: Flags [P.], seq 77984:78140, ack 37, win 319, length 156
10:41:38.931545 IP 165.227.45.151.22 > 174.91.38.241.63354: Flags [P.], seq 78140:78400, ack 37, win 319, length 260
10:41:38.931598 IP 165.227.45.151.22 > 174.91.38.241.63354: Flags [P.], seq 78400:78556, ack 37, win 319, length 156
10:41:38.934256 IP 174.91.38.241.63354 > 165.227.45.151.22: Flags [.], ack 70608, win 8292, length 0
10:41:38.934288 IP 165.227.45.151.22 > 174.91.38.241.63354: Flags [P.], seq 78556:78712, ack 37, win 319, length 156
10:41:38.934416 IP 165.227.45.151.22 > 174.91.38.241.63354: Flags [P.], seq 78712:78972, ack 37, win 319, length 260
10:41:38.934535 IP 165.227.45.151.22 > 174.91.38.241.63354: Flags [P.], seq 78972:79128, ack 37, win 319, length 156
10:41:38.934590 IP 165.227.45.151.22 > 174.91.38.241.63354: Flags [P.], seq 79128:79284, ack 37, win 319, length 156
10:41:38.934641 IP 165.227.45.151.22 > 174.91.38.241.63354: Flags [P.], seq 79284:79440, ack 37, win 319, length 156
10:41:38.934690 IP 165.227.45.151.22 > 174.91.38.241.63354: Flags [P.], seq 79440:79596, ack 37, win 319, length 156
10:41:38.935978 IP 174.91.38.241.63354 > 165.227.45.151.22: Flags [.], ack 71076, win 8290, length 0
10:41:38.935997 IP 165.227.45.151.22 > 174.91.38.241.63354: Flags [P.], seq 79596:79752, ack 37, win 319, length 156
10:41:38.936088 IP 165.227.45.151.22 > 174.91.38.241.63354: Flags [P.], seq 79752:80012, ack 37, win 319, length 260
10:41:38.936151 IP 165.227.45.151.22 > 174.91.38.241.63354: Flags [P.], seq 80012:80168, ack 37, win 319, length 156
10:41:38.936203 IP 174.91.38.241.63354 > 165.227.45.151.22: Flags [.], ack 76944, win 8290, length 0
10:41:38.936295 IP 165.227.45.151.22 > 174.91.38.241.63354: Flags [P.], seq 80168:80428, ack 37, win 319, length 260
10:41:38.936370 IP 165.227.45.151.22 > 174.91.38.241.63354: Flags [P.], seq 80428:80584, ack 37, win 319, length 156
10:41:38.936416 IP 165.227.45.151.22 > 174.91.38.241.63354: Flags [P.], seq 80584:80740, ack 37, win 319, length 156
10:41:38.936470 IP 174.91.38.241.63354 > 165.227.45.151.22: Flags [.], ack 76476, win 8292, length 0
10:41:38.936543 IP 165.227.45.151.22 > 174.91.38.241.63354: Flags [P.], seq 80740:81000, ack 37, win 319, length 260
10:41:38.936630 IP 165.227.45.151.22 > 174.91.38.241.63354: Flags [P.], seq 81000:81156, ack 37, win 319, length 156
10:41:38.936702 IP 174.91.38.241.63354 > 165.227.45.151.22: Flags [.], ack 72896, win 8289, length 0
10:41:38.936713 IP 174.91.38.241.63354 > 165.227.45.151.22: Flags [.], ack 72116, win 8292, length 0
10:41:38.936783 IP 165.227.45.151.22 > 174.91.38.241.63354: Flags [P.], seq 81156:81312, ack 37, win 319, length 156
10:41:38.936819 IP 165.227.45.151.22 > 174.91.38.241.63354: Flags [P.], seq 81312:81556, ack 37, win 319, length 244
10:41:38.936900 IP 165.227.45.151.22 > 174.91.38.241.63354: Flags [P.], seq 81556:81832, ack 37, win 319, length 276
10:41:38.936967 IP 174.91.38.241.63354 > 165.227.45.151.22: Flags [.], ack 77412, win 8288, length 0
10:41:38.937024 IP 165.227.45.151.22 > 174.91.38.241.63354: Flags [P.], seq 81832:81988, ack 37, win 319, length 156
10:41:38.937099 IP 165.227.45.151.22 > 174.91.38.241.63354: Flags [P.], seq 81988:82128, ack 37, win 319, length 140
10:41:38.937146 IP 165.227.45.151.22 > 174.91.38.241.63354: Flags [P.], seq 82128:82284, ack 37, win 319, length 156
10:41:38.937213 IP 165.227.45.151.22 > 174.91.38.241.63354: Flags [P.], seq 82284:82440, ack 37, win 319, length 156
10:41:38.937338 IP 165.227.45.151.22 > 174.91.38.241.63354: Flags [P.], seq 82440:82596, ack 37, win 319, length 156
10:41:38.937422 IP 165.227.45.151.22 > 174.91.38.241.63354: Flags [P.], seq 82596:82752, ack 37, win 319, length 156
10:41:38.937489 IP 165.227.45.151.22 > 174.91.38.241.63354: Flags [P.], seq 82752:82908, ack 37, win 319, length 156
10:41:38.937543 IP 165.227.45.151.22 > 174.91.38.241.63354: Flags [P.], seq 82908:83064, ack 37, win 319, length 156
10:41:38.937609 IP 165.227.45.151.22 > 174.91.38.241.63354: Flags [P.], seq 83064:83220, ack 37, win 319, length 156
10:41:38.937663 IP 165.227.45.151.22 > 174.91.38.241.63354: Flags [P.], seq 83220:83376, ack 37, win 319, length 156
10:41:38.937714 IP 165.227.45.151.22 > 174.91.38.241.63354: Flags [P.], seq 83376:83532, ack 37, win 319, length 156
10:41:38.937769 IP 165.227.45.151.22 > 174.91.38.241.63354: Flags [P.], seq 83532:83688, ack 37, win 319, length 156
10:41:38.937814 IP 165.227.45.151.22 > 174.91.38.241.63354: Flags [P.], seq 83688:83844, ack 37, win 319, length 156
10:41:38.937857 IP 165.227.45.151.22 > 174.91.38.241.63354: Flags [P.], seq 83844:84000, ack 37, win 319, length 156
10:41:38.937901 IP 165.227.45.151.22 > 174.91.38.241.63354: Flags [P.], seq 84000:84156, ack 37, win 319, length 156
10:41:38.937921 IP 165.227.45.151.22 > 174.91.38.241.63354: Flags [P.], seq 84156:84312, ack 37, win 319, length 156
10:41:38.937978 IP 165.227.45.151.22 > 174.91.38.241.63354: Flags [P.], seq 84312:84588, ack 37, win 319, length 276
10:41:38.938026 IP 165.227.45.151.22 > 174.91.38.241.63354: Flags [P.], seq 84588:84744, ack 37, win 319, length 156
10:41:38.938074 IP 165.227.45.151.22 > 174.91.38.241.63354: Flags [P.], seq 84744:84900, ack 37, win 319, length 156
10:41:38.938122 IP 165.227.45.151.22 > 174.91.38.241.63354: Flags [P.], seq 84900:85056, ack 37, win 319, length 156
10:41:38.938170 IP 165.227.45.151.22 > 174.91.38.241.63354: Flags [P.], seq 85056:85212, ack 37, win 319, length 156
10:41:38.938217 IP 165.227.45.151.22 > 174.91.38.241.63354: Flags [P.], seq 85212:85368, ack 37, win 319, length 156
10:41:38.938266 IP 165.227.45.151.22 > 174.91.38.241.63354: Flags [P.], seq 85368:85524, ack 37, win 319, length 156
10:41:38.938313 IP 165.227.45.151.22 > 174.91.38.241.63354: Flags [P.], seq 85524:85680, ack 37, win 319, length 156
10:41:38.938367 IP 165.227.45.151.22 > 174.91.38.241.63354: Flags [P.], seq 85680:85836, ack 37, win 319, length 156
10:41:38.938442 IP 165.227.45.151.22 > 174.91.38.241.63354: Flags [P.], seq 85836:85992, ack 37, win 319, length 156
10:41:38.938520 IP 165.227.45.151.22 > 174.91.38.241.63354: Flags [P.], seq 85992:86148, ack 37, win 319, length 156
10:41:38.938577 IP 165.227.45.151.22 > 174.91.38.241.63354: Flags [P.], seq 86148:86304, ack 37, win 319, length 156
10:41:38.938628 IP 165.227.45.151.22 > 174.91.38.241.63354: Flags [P.], seq 86304:86460, ack 37, win 319, length 156
10:41:38.938676 IP 165.227.45.151.22 > 174.91.38.241.63354: Flags [P.], seq 86460:86616, ack 37, win 319, length 156
10:41:38.939965 IP 174.91.38.241.63354 > 165.227.45.151.22: Flags [.], ack 77984, win 8292, length 0
10:41:38.939982 IP 165.227.45.151.22 > 174.91.38.241.63354: Flags [P.], seq 86616:86772, ack 37, win 319, length 156
10:41:38.940079 IP 165.227.45.151.22 > 174.91.38.241.63354: Flags [P.], seq 86772:87032, ack 37, win 319, length 260
10:41:38.940139 IP 165.227.45.151.22 > 174.91.38.241.63354: Flags [P.], seq 87032:87188, ack 37, win 319, length 156
10:41:38.940196 IP 174.91.38.241.63354 > 165.227.45.151.22: Flags [.], ack 77568, win 8288, length 0
10:41:38.943225 IP 174.91.38.241.63354 > 165.227.45.151.22: Flags [.], ack 78556, win 8290, length 0
10:41:38.943250 IP 165.227.45.151.22 > 174.91.38.241.63354: Flags [P.], seq 87188:87484, ack 37, win 319, length 296
10:41:38.943393 IP 165.227.45.151.22 > 174.91.38.241.63354: Flags [P.], seq 87484:87744, ack 37, win 319, length 260
10:41:38.943476 IP 165.227.45.151.22 > 174.91.38.241.63354: Flags [P.], seq 87744:87900, ack 37, win 319, length 156
10:41:38.943959 IP 174.91.38.241.63354 > 165.227.45.151.22: Flags [.], ack 78712, win 8289, length 0
10:41:38.943973 IP 165.227.45.151.22 > 174.91.38.241.63354: Flags [P.], seq 87900:88056, ack 37, win 319, length 156
10:41:38.946726 IP 174.91.38.241.63354 > 165.227.45.151.22: Flags [.], ack 79284, win 8287, length 0
10:41:38.946746 IP 165.227.45.151.22 > 174.91.38.241.63354: Flags [P.], seq 88056:88316, ack 37, win 319, length 260
10:41:38.946849 IP 165.227.45.151.22 > 174.91.38.241.63354: Flags [P.], seq 88316:88576, ack 37, win 319, length 260
10:41:38.946906 IP 165.227.45.151.22 > 174.91.38.241.63354: Flags [P.], seq 88576:88732, ack 37, win 319, length 156
10:41:38.948229 IP 174.91.38.241.63354 > 165.227.45.151.22: Flags [.], ack 81000, win 8287, length 0
10:41:38.948263 IP 165.227.45.151.22 > 174.91.38.241.63354: Flags [P.], seq 88732:88888, ack 37, win 319, length 156
10:41:38.948357 IP 165.227.45.151.22 > 174.91.38.241.63354: Flags [P.], seq 88888:89148, ack 37, win 319, length 260
10:41:38.948420 IP 165.227.45.151.22 > 174.91.38.241.63354: Flags [P.], seq 89148:89304, ack 37, win 319, length 156
10:41:38.948450 IP 174.91.38.241.63354 > 165.227.45.151.22: Flags [.], ack 79752, win 8292, length 0
10:41:38.948513 IP 165.227.45.151.22 > 174.91.38.241.63354: Flags [P.], seq 89304:89564, ack 37, win 319, length 260
10:41:38.948569 IP 165.227.45.151.22 > 174.91.38.241.63354: Flags [P.], seq 89564:89720, ack 37, win 319, length 156
10:41:38.948620 IP 165.227.45.151.22 > 174.91.38.241.63354: Flags [P.], seq 89720:89876, ack 37, win 319, length 156
10:41:38.948680 IP 165.227.45.151.22 > 174.91.38.241.63354: Flags [P.], seq 89876:90032, ack 37, win 319, length 156
10:41:38.948731 IP 165.227.45.151.22 > 174.91.38.241.63354: Flags [P.], seq 90032:90188, ack 37, win 319, length 156
10:41:38.948779 IP 165.227.45.151.22 > 174.91.38.241.63354: Flags [P.], seq 90188:90344, ack 37, win 319, length 156
10:41:38.949717 IP 174.91.38.241.63354 > 165.227.45.151.22: Flags [.], ack 84312, win 8292, length 0
10:41:38.949746 IP 165.227.45.151.22 > 174.91.38.241.63354: Flags [P.], seq 90344:90500, ack 37, win 319, length 156
10:41:38.949831 IP 165.227.45.151.22 > 174.91.38.241.63354: Flags [P.], seq 90500:90760, ack 37, win 319, length 260
10:41:38.949887 IP 165.227.45.151.22 > 174.91.38.241.63354: Flags [P.], seq 90760:90916, ack 37, win 319, length 156
10:41:38.949936 IP 165.227.45.151.22 > 174.91.38.241.63354: Flags [P.], seq 90916:91072, ack 37, win 319, length 156
10:41:38.949984 IP 165.227.45.151.22 > 174.91.38.241.63354: Flags [P.], seq 91072:91228, ack 37, win 319, length 156
10:41:38.950034 IP 165.227.45.151.22 > 174.91.38.241.63354: Flags [P.], seq 91228:91384, ack 37, win 319, length 156
10:41:38.950091 IP 165.227.45.151.22 > 174.91.38.241.63354: Flags [P.], seq 91384:91540, ack 37, win 319, length 156
10:41:38.950145 IP 165.227.45.151.22 > 174.91.38.241.63354: Flags [P.], seq 91540:91696, ack 37, win 319, length 156
10:41:38.950197 IP 165.227.45.151.22 > 174.91.38.241.63354: Flags [P.], seq 91696:91852, ack 37, win 319, length 156
10:41:38.950255 IP 165.227.45.151.22 > 174.91.38.241.63354: Flags [P.], seq 91852:92008, ack 37, win 319, length 156
10:41:38.950310 IP 165.227.45.151.22 > 174.91.38.241.63354: Flags [P.], seq 92008:92164, ack 37, win 319, length 156
10:41:38.950377 IP 165.227.45.151.22 > 174.91.38.241.63354: Flags [P.], seq 92164:92320, ack 37, win 319, length 156
10:41:38.950443 IP 165.227.45.151.22 > 174.91.38.241.63354: Flags [P.], seq 92320:92476, ack 37, win 319, length 156
10:41:38.950523 IP 165.227.45.151.22 > 174.91.38.241.63354: Flags [P.], seq 92476:92632, ack 37, win 319, length 156
10:41:38.950577 IP 165.227.45.151.22 > 174.91.38.241.63354: Flags [P.], seq 92632:92788, ack 37, win 319, length 156
10:41:38.950630 IP 165.227.45.151.22 > 174.91.38.241.63354: Flags [P.], seq 92788:92944, ack 37, win 319, length 156
10:41:38.950682 IP 165.227.45.151.22 > 174.91.38.241.63354: Flags [P.], seq 92944:93100, ack 37, win 319, length 156
10:41:38.950730 IP 165.227.45.151.22 > 174.91.38.241.63354: Flags [P.], seq 93100:93256, ack 37, win 319, length 156
10:41:38.950778 IP 165.227.45.151.22 > 174.91.38.241.63354: Flags [P.], seq 93256:93412, ack 37, win 319, length 156
10:41:38.950839 IP 165.227.45.151.22 > 174.91.38.241.63354: Flags [P.], seq 93412:93568, ack 37, win 319, length 156
10:41:38.951715 IP 174.91.38.241.63354 > 165.227.45.151.22: Flags [.], ack 87188, win 8287, length 0
10:41:38.951737 IP 165.227.45.151.22 > 174.91.38.241.63354: Flags [P.], seq 93568:93724, ack 37, win 319, length 156
10:41:38.951813 IP 165.227.45.151.22 > 174.91.38.241.63354: Flags [P.], seq 93724:93984, ack 37, win 319, length 260
10:41:38.951867 IP 165.227.45.151.22 > 174.91.38.241.63354: Flags [P.], seq 93984:94140, ack 37, win 319, length 156
10:41:38.951915 IP 165.227.45.151.22 > 174.91.38.241.63354: Flags [P.], seq 94140:94296, ack 37, win 319, length 156
10:41:38.951963 IP 174.91.38.241.63354 > 165.227.45.151.22: Flags [.], ack 85992, win 8292, length 0
